{
  "model_version": "0.1.0",
  "model_family": "inc15d-govman-2025-crosswalk",
  "source_package_id": "GOVMAN-2025-12-31",
  "source_publication_date": "2025-12-31",
  "original_source_sha256": "c1e5b58cce0a018b4995f900584605d07e473079a37d5a665a3a8ebb5d643138",
  "source_original_repository_path": "evidence/govman-2025/originals/sha256/c1e5b58cce0a018b4995f900584605d07e473079a37d5a665a3a8ebb5d643138.xml",
  "whole_federal_legal_institution_denominator": null,
  "current_first_level_institution_denominator": null,
  "independent_legal_review_complete": false,
  "independent_worm_custody_verified": false,
  "publisher_entry_count": 231,
  "explicit_provisional_links": 50,
  "unresolved_entries": 181,
  "existing_canonical_ids_replaced": 0,
  "source_local_identifiers_not_permanent": true,
  "items": [
    {
      "id": "INC15D-XWALK-70",
      "source_entity_key": "GOVMAN-2025-12-31:70",
      "publisher_name": "Congress",
      "publisher_category": "Legislative Branch",
      "canonical_id": "ORG-FED-LEG-CONGRESS",
      "previous_x12_identity_id": "X12-IDENTITY-ORG-FED-LEG-CONGRESS",
      "canonical_model_path": "model/federal/legislative.json",
      "identity_reconciliation_state": "provisional_explicit_source_name_or_alias",
      "review_status": "research_only_not_independently_qualified",
      "legal_identity_certified": false,
      "legal_authority_inferred": false,
      "command_delegation_inferred": false
    },
    {
      "id": "INC15D-XWALK-202",
      "source_entity_key": "GOVMAN-2025-12-31:202",
      "publisher_name": "The Senate",
      "publisher_category": "Legislative Branch",
      "canonical_id": "ORG-FED-LEG-SENATE",
      "previous_x12_identity_id": "X12-IDENTITY-ORG-FED-LEG-SENATE",
      "canonical_model_path": "model/federal/legislative.json",
      "identity_reconciliation_state": "provisional_explicit_source_name_or_alias",
      "review_status": "research_only_not_independently_qualified",
      "legal_identity_certified": false,
      "legal_authority_inferred": false,
      "command_delegation_inferred": false
    },
    {
      "id": "INC15D-XWALK-72",
      "source_entity_key": "GOVMAN-2025-12-31:72",
      "publisher_name": "The House of Representatives",
      "publisher_category": "Legislative Branch",
      "canonical_id": "ORG-FED-LEG-HOUSE",
      "previous_x12_identity_id": "X12-IDENTITY-ORG-FED-LEG-HOUSE",
      "canonical_model_path": "model/federal/legislative.json",
      "identity_reconciliation_state": "provisional_explicit_source_name_or_alias",
      "review_status": "research_only_not_independently_qualified",
      "legal_identity_certified": false,
      "legal_authority_inferred": false,
      "command_delegation_inferred": false
    },
    {
      "id": "INC15D-XWALK-73",
      "source_entity_key": "GOVMAN-2025-12-31:73",
      "publisher_name": "Architect of the Capitol",
      "publisher_category": "Legislative Branch",
      "canonical_id": "ORG-FED-LEG-AOC",
      "previous_x12_identity_id": "X12-IDENTITY-ORG-FED-LEG-AOC",
      "canonical_model_path": "model/federal/legislative.json",
      "identity_reconciliation_state": "provisional_explicit_source_name_or_alias",
      "review_status": "research_only_not_independently_qualified",
      "legal_identity_certified": false,
      "legal_authority_inferred": false,
      "command_delegation_inferred": false
    },
    {
      "id": "INC15D-XWALK-79",
      "source_entity_key": "GOVMAN-2025-12-31:79",
      "publisher_name": "Congressional Budget Office",
      "publisher_category": "Legislative Branch",
      "canonical_id": "ORG-FED-LEG-CBO",
      "previous_x12_identity_id": "X12-IDENTITY-ORG-FED-LEG-CBO",
      "canonical_model_path": "model/federal/legislative.json",
      "identity_reconciliation_state": "provisional_explicit_source_name_or_alias",
      "review_status": "research_only_not_independently_qualified",
      "legal_identity_certified": false,
      "legal_authority_inferred": false,
      "command_delegation_inferred": false
    },
    {
      "id": "INC15D-XWALK-75",
      "source_entity_key": "GOVMAN-2025-12-31:75",
      "publisher_name": "Government Accountability Office",
      "publisher_category": "Legislative Branch",
      "canonical_id": "ORG-FED-LEG-GAO",
      "previous_x12_identity_id": "X12-IDENTITY-ORG-FED-LEG-GAO",
      "canonical_model_path": "model/federal/legislative.json",
      "identity_reconciliation_state": "provisional_explicit_source_name_or_alias",
      "review_status": "research_only_not_independently_qualified",
      "legal_identity_certified": false,
      "legal_authority_inferred": false,
      "command_delegation_inferred": false
    },
    {
      "id": "INC15D-XWALK-76",
      "source_entity_key": "GOVMAN-2025-12-31:76",
      "publisher_name": "Government Publishing Office",
      "publisher_category": "Legislative Branch",
      "canonical_id": "ORG-FED-LEG-GPO",
      "previous_x12_identity_id": "X12-IDENTITY-ORG-FED-LEG-GPO",
      "canonical_model_path": "model/federal/legislative.json",
      "identity_reconciliation_state": "provisional_explicit_source_name_or_alias",
      "review_status": "research_only_not_independently_qualified",
      "legal_identity_certified": false,
      "legal_authority_inferred": false,
      "command_delegation_inferred": false
    },
    {
      "id": "INC15D-XWALK-77",
      "source_entity_key": "GOVMAN-2025-12-31:77",
      "publisher_name": "Library of Congress",
      "publisher_category": "Legislative Branch",
      "canonical_id": "ORG-FED-LEG-LOC",
      "previous_x12_identity_id": "X12-IDENTITY-ORG-FED-LEG-LOC",
      "canonical_model_path": "model/federal/legislative.json",
      "identity_reconciliation_state": "provisional_explicit_source_name_or_alias",
      "review_status": "research_only_not_independently_qualified",
      "legal_identity_certified": false,
      "legal_authority_inferred": false,
      "command_delegation_inferred": false
    },
    {
      "id": "INC15D-XWALK-78",
      "source_entity_key": "GOVMAN-2025-12-31:78",
      "publisher_name": "Congressional Research Service",
      "publisher_category": "Legislative Branch",
      "canonical_id": "ORG-FED-LEG-CRS",
      "previous_x12_identity_id": "X12-IDENTITY-ORG-FED-LEG-CRS",
      "canonical_model_path": "model/federal/legislative.json",
      "identity_reconciliation_state": "provisional_explicit_source_name_or_alias",
      "review_status": "research_only_not_independently_qualified",
      "legal_identity_certified": false,
      "legal_authority_inferred": false,
      "command_delegation_inferred": false
    },
    {
      "id": "INC15D-XWALK-74",
      "source_entity_key": "GOVMAN-2025-12-31:74",
      "publisher_name": "United States Botanic Garden",
      "publisher_category": "Legislative Branch",
      "canonical_id": null,
      "previous_x12_identity_id": null,
      "canonical_model_path": null,
      "identity_reconciliation_state": "unresolved_publisher_directory_entry",
      "review_status": "research_only_not_independently_qualified",
      "legal_identity_certified": false,
      "legal_authority_inferred": false,
      "command_delegation_inferred": false
    },
    {
      "id": "INC15D-XWALK-80",
      "source_entity_key": "GOVMAN-2025-12-31:80",
      "publisher_name": "The Supreme Court of the United States",
      "publisher_category": "Judicial Branch",
      "canonical_id": "ORG-FED-JUD-SCOTUS",
      "previous_x12_identity_id": "X12-IDENTITY-ORG-FED-JUD-SCOTUS",
      "canonical_model_path": "model/federal/judiciary.json",
      "identity_reconciliation_state": "provisional_explicit_source_name_or_alias",
      "review_status": "research_only_not_independently_qualified",
      "legal_identity_certified": false,
      "legal_authority_inferred": false,
      "command_delegation_inferred": false
    },
    {
      "id": "INC15D-XWALK-81",
      "source_entity_key": "GOVMAN-2025-12-31:81",
      "publisher_name": "Lower Courts",
      "publisher_category": "Judicial Branch",
      "canonical_id": null,
      "previous_x12_identity_id": null,
      "canonical_model_path": null,
      "identity_reconciliation_state": "unresolved_publisher_directory_entry",
      "review_status": "research_only_not_independently_qualified",
      "legal_identity_certified": false,
      "legal_authority_inferred": false,
      "command_delegation_inferred": false
    },
    {
      "id": "INC15D-XWALK-82",
      "source_entity_key": "GOVMAN-2025-12-31:82",
      "publisher_name": "United States Courts of Appeals",
      "publisher_category": "Judicial Branch",
      "canonical_id": "ORG-FED-JUD-APPEALS",
      "previous_x12_identity_id": "X12-IDENTITY-ORG-FED-JUD-APPEALS",
      "canonical_model_path": "model/federal/judiciary.json",
      "identity_reconciliation_state": "provisional_explicit_source_name_or_alias",
      "review_status": "research_only_not_independently_qualified",
      "legal_identity_certified": false,
      "legal_authority_inferred": false,
      "command_delegation_inferred": false
    },
    {
      "id": "INC15D-XWALK-83",
      "source_entity_key": "GOVMAN-2025-12-31:83",
      "publisher_name": "United States Court of Appeals for the Federal Circuit",
      "publisher_category": "Judicial Branch",
      "canonical_id": null,
      "previous_x12_identity_id": null,
      "canonical_model_path": null,
      "identity_reconciliation_state": "unresolved_publisher_directory_entry",
      "review_status": "research_only_not_independently_qualified",
      "legal_identity_certified": false,
      "legal_authority_inferred": false,
      "command_delegation_inferred": false
    },
    {
      "id": "INC15D-XWALK-84",
      "source_entity_key": "GOVMAN-2025-12-31:84",
      "publisher_name": "United States District Courts",
      "publisher_category": "Judicial Branch",
      "canonical_id": "ORG-FED-JUD-DISTRICT",
      "previous_x12_identity_id": "X12-IDENTITY-ORG-FED-JUD-DISTRICT",